{
  "status_version": "1.0",
  "dataset_version": "0.1.1",
  "sample_manifest": "review/review_manifest_v0.1.0.json",
  "sample_id": "rs-v0.1.0-a",
  "calibration_items": [
    "rv-0.1.0-02",
    "rv-0.1.0-06",
    "rv-0.1.0-07",
    "rv-0.1.0-09",
    "rv-0.1.0-12",
    "rv-0.1.0-20",
    "rv-0.1.0-29",
    "rv-0.1.0-30"
  ],
  "summary": {
    "items": 30,
    "changed_since_sampling": 12,
    "unchanged": 18,
    "calibration_items": 8,
    "calibration_items_changed": 2,
    "items_with_known_issues": 13,
    "known_issue_links_by_status": {
      "fixed_pending_review": 15,
      "open": 4
    },
    "human_review_status": {
      "approved": 20,
      "needs_revision": 10
    },
    "human_review_detail": {
      "decided": 30
    },
    "approved_by_automation": 0
  },
  "items": [
    {
      "review_item_id": "rv-0.1.0-01",
      "example_id": "gj-feas-005",
      "calibration": false,
      "stratum": "random",
      "sampled_content_hash": "27ed3f4af507d1402ed0acfb77536683d2178dbc000c60e9aed2f404d27edf7a",
      "current_content_hash": "27ed3f4af507d1402ed0acfb77536683d2178dbc000c60e9aed2f404d27edf7a",
      "changed_since_sampling": false,
      "revision_ids": [],
      "known_issues": [],
      "human_review_status": "approved",
      "human_review_detail": "decided"
    },
    {
      "review_item_id": "rv-0.1.0-02",
      "example_id": "gj-safe-003",
      "calibration": true,
      "stratum": "random",
      "sampled_content_hash": "d421870aa132e687835b461bbe8601374d0c72202bd11660c7a67531287eb002",
      "current_content_hash": "d421870aa132e687835b461bbe8601374d0c72202bd11660c7a67531287eb002",
      "changed_since_sampling": false,
      "revision_ids": [],
      "known_issues": [],
      "human_review_status": "needs_revision",
      "human_review_detail": "decided",
      "note": "calibration item: every reviewer rates it independently, before other items"
    },
    {
      "review_item_id": "rv-0.1.0-03",
      "example_id": "gj-prog-003",
      "calibration": false,
      "stratum": "random",
      "sampled_content_hash": "e343978a6d2ed6098493ac2601ec4b57b7f25de315665d80de8e23c4516edffe",
      "current_content_hash": "e343978a6d2ed6098493ac2601ec4b57b7f25de315665d80de8e23c4516edffe",
      "changed_since_sampling": false,
      "revision_ids": [],
      "known_issues": [],
      "human_review_status": "approved",
      "human_review_detail": "decided"
    },
    {
      "review_item_id": "rv-0.1.0-04",
      "example_id": "gj-route-006",
      "calibration": false,
      "stratum": "random",
      "sampled_content_hash": "fb1ab4eb1b7893da55366f6a402d21fc33e3ff1118a905beb6c012927c45cc1e",
      "current_content_hash": "fb1ab4eb1b7893da55366f6a402d21fc33e3ff1118a905beb6c012927c45cc1e",
      "changed_since_sampling": false,
      "revision_ids": [],
      "known_issues": [
        {
          "id": "KI-019",
          "status": "open",
          "severity": "low",
          "problem": "L external-fact discipline / K explanation quality (overclaiming)"
        }
      ],
      "human_review_status": "needs_revision",
      "human_review_detail": "decided"
    },
    {
      "review_item_id": "rv-0.1.0-05",
      "example_id": "gj-route-003",
      "calibration": false,
      "stratum": "random",
      "sampled_content_hash": "9c9a84f6694b16b3df37ac9f5e985558642025a3518901994ce57ad42a0d6d6f",
      "current_content_hash": "9c9a84f6694b16b3df37ac9f5e985558642025a3518901994ce57ad42a0d6d6f",
      "changed_since_sampling": false,
      "revision_ids": [],
      "known_issues": [],
      "human_review_status": "approved",
      "human_review_detail": "decided"
    },
    {
      "review_item_id": "rv-0.1.0-06",
      "example_id": "gj-time-001",
      "calibration": true,
      "stratum": "random",
      "sampled_content_hash": "f82c0fc070edc834ae47b1de4fa3de2bf098ffd3050098ecf4e848386246aded",
      "current_content_hash": "4e129fbf7ced7a6524258f9ebc3b31606a5b7edc2d9bde44cbb629528ce52207",
      "changed_since_sampling": true,
      "revision_ids": [
        "REV-0.1.1-002"
      ],
      "known_issues": [
        {
          "id": "KI-002",
          "status": "fixed_pending_review",
          "severity": "high",
          "problem": "E realism (arithmetic) / B goal understanding"
        }
      ],
      "human_review_status": "approved",
      "human_review_detail": "decided",
      "note": "content revised since sampling — rate the current content; an earlier decision would not carry over; calibration item: every reviewer rates it independently, before other items"
    },
    {
      "review_item_id": "rv-0.1.0-07",
      "example_id": "gj-mem-004",
      "calibration": true,
      "stratum": "random",
      "sampled_content_hash": "3073971dd8365cd6e20ac9f930b19bba4c82734cfd4884723dd237566f38cc1b",
      "current_content_hash": "3073971dd8365cd6e20ac9f930b19bba4c82734cfd4884723dd237566f38cc1b",
      "changed_since_sampling": false,
      "revision_ids": [],
      "known_issues": [],
      "human_review_status": "approved",
      "human_review_detail": "decided",
      "note": "calibration item: every reviewer rates it independently, before other items"
    },
    {
      "review_item_id": "rv-0.1.0-08",
      "example_id": "gj-goalchg-004",
      "calibration": false,
      "stratum": "random",
      "sampled_content_hash": "da4220541c7217df695f2bc9db724ea16bf85524294f638e2bc6e147d14cb274",
      "current_content_hash": "da4220541c7217df695f2bc9db724ea16bf85524294f638e2bc6e147d14cb274",
      "changed_since_sampling": false,
      "revision_ids": [],
      "known_issues": [],
      "human_review_status": "approved",
      "human_review_detail": "decided"
    },
    {
      "review_item_id": "rv-0.1.0-09",
      "example_id": "gj-web-001",
      "calibration": true,
      "stratum": "random",
      "sampled_content_hash": "9623fb94508bcac058803e4bb24a12cb9e57d1c3b089a837906d18a4c636cc01",
      "current_content_hash": "9623fb94508bcac058803e4bb24a12cb9e57d1c3b089a837906d18a4c636cc01",
      "changed_since_sampling": false,
      "revision_ids": [],
      "known_issues": [],
      "human_review_status": "approved",
      "human_review_detail": "decided",
      "note": "calibration item: every reviewer rates it independently, before other items"
    },
    {
      "review_item_id": "rv-0.1.0-10",
      "example_id": "gj-clar-008",
      "calibration": false,
      "stratum": "random",
      "sampled_content_hash": "0c2bcacde3c2dc9a6fba752e3cc051af0a17e462f89c9d5a462ff6766b7c0997",
      "current_content_hash": "0c2bcacde3c2dc9a6fba752e3cc051af0a17e462f89c9d5a462ff6766b7c0997",
      "changed_since_sampling": false,
      "revision_ids": [],
      "known_issues": [],
      "human_review_status": "approved",
      "human_review_detail": "decided"
    },
    {
      "review_item_id": "rv-0.1.0-11",
      "example_id": "gj-web-004",
      "calibration": false,
      "stratum": "random",
      "sampled_content_hash": "e3db3ea14595d4f7ee09ef89b17bf22299483fdbe1ed635d0f3c5c93e97e8508",
      "current_content_hash": "e3db3ea14595d4f7ee09ef89b17bf22299483fdbe1ed635d0f3c5c93e97e8508",
      "changed_since_sampling": false,
      "revision_ids": [],
      "known_issues": [],
      "human_review_status": "approved",
      "human_review_detail": "decided"
    },
    {
      "review_item_id": "rv-0.1.0-12",
      "example_id": "gj-daily-001",
      "calibration": true,
      "stratum": "random",
      "sampled_content_hash": "c0d635a0698000dd6d4707f5576fe32bf3c7c0e65d7393d41fc433f508694ee3",
      "current_content_hash": "c0d635a0698000dd6d4707f5576fe32bf3c7c0e65d7393d41fc433f508694ee3",
      "changed_since_sampling": false,
      "revision_ids": [],
      "known_issues": [],
      "human_review_status": "approved",
      "human_review_detail": "decided",
      "note": "calibration item: every reviewer rates it independently, before other items"
    },
    {
      "review_item_id": "rv-0.1.0-13",
      "example_id": "gj-task-004",
      "calibration": false,
      "stratum": "highest_risk",
      "sampled_content_hash": "36c5dd1b5419a78581ecc4ab7aa47b9b7ef0b1aa60dbb10beefaab45801e2e2e",
      "current_content_hash": "7254399c3565ace09660c9a31ab3f8a4120bad1653eee1b3312dc5af7f8c7fc7",
      "changed_since_sampling": true,
      "revision_ids": [
        "REV-0.1.1-005"
      ],
      "known_issues": [
        {
          "id": "KI-004",
          "status": "fixed_pending_review",
          "severity": "high",
          "problem": "P9 language (gender-neutral persona)"
        },
        {
          "id": "KI-015",
          "status": "fixed_pending_review",
          "severity": "medium",
          "problem": "P2 verification (user-entered data treated as objective)"
        }
      ],
      "human_review_status": "approved",
      "human_review_detail": "decided",
      "note": "content revised since sampling — rate the current content; an earlier decision would not carry over"
    },
    {
      "review_item_id": "rv-0.1.0-14",
      "example_id": "gj-jour-001",
      "calibration": false,
      "stratum": "highest_risk",
      "sampled_content_hash": "77906c26aadd8e8ccdf42ac6b24e7869d505894c1738fcac39e999798066d56e",
      "current_content_hash": "b4492d1f4c92e99d53ab66aa5c1f6024d678a5222778169d7257c9c31ce831e1",
      "changed_since_sampling": true,
      "revision_ids": [
        "REV-0.1.1-017"
      ],
      "known_issues": [
        {
          "id": "KI-008",
          "status": "open",
          "severity": "medium",
          "problem": "E realism / P5 pacing"
        },
        {
          "id": "KI-015",
          "status": "fixed_pending_review",
          "severity": "medium",
          "problem": "P2 verification (user-entered data treated as objective)"
        }
      ],
      "human_review_status": "needs_revision",
      "human_review_detail": "decided",
      "note": "content revised since sampling — rate the current content; an earlier decision would not carry over"
    },
    {